<?xml version="1.0" encoding="UTF-8"?>
<!-- 
Nombre: Carlos Gil
Curso: [Asir] 
Fecha: [3/4/2025] 
Ejercicio: [Nba] 
-->
-->
<!DOCTYPE aeropuerto SYSTEM "aeropuerto.dtd">
<aeropuerto>
    <nombre>JFK</nombre>
    <panel>
        <vuelo codigo="V22" estado="R">
            <diario />
            <origen>New York</origen>
            <destino>Chicago</destino>
            <hora_salida>9:30</hora_salida>
            <hora_llegada>11:30</hora_llegada>
        </vuelo>
        <vuelo codigo="V23" estado="C">
            <origen>New York</origen>
            <destino>Miami</destino>
            <hora_salida>10:15</hora_salida>
            <hora_llegada>11:15</hora_llegada>
        </vuelo>
    </panel>
    <fecha>20/12/2013</fecha>
</aeropuerto>